{
  "schema_version": "campaigns-os-tooling-orientation/v1",
  "request": {
    "run_id": "run-example-0001",
    "checkout_mode": "managed",
    "mutation_policy": "observe_only",
    "baseline": {
      "kind": "supported_surface",
      "commit": "1111111111111111111111111111111111111111",
      "surface_version": "1.13.0"
    },
    "accepted_orientation_schemas": [
      "campaigns-os-tooling-orientation/v1"
    ],
    "accepted_surface_range": ">=1.13.0 <2.0.0",
    "manifest_sha256": "3333333333333333333333333333333333333333333333333333333333333333"
  },
  "repository": {
    "owner": "NextCommerceCo",
    "repository": "campaigns-os",
    "branch": "main",
    "upstream": "origin/main",
    "clean": true,
    "shallow": false,
    "graph_relation": "identical",
    "common_git_identity": "managed-store-0001",
    "worktree_identity": "generation-0001",
    "commit_before": "1111111111111111111111111111111111111111",
    "commit_fetched": "1111111111111111111111111111111111111111",
    "commit_after": "1111111111111111111111111111111111111111"
  },
  "freshness": {
    "state": "refused",
    "observed_at": "2026-08-28T00:00:00Z",
    "fetch_result": {
      "attempted": true,
      "succeeded": true,
      "duration_ms": 610
    }
  },
  "surface": {
    "reviewed_version": "1.13.0",
    "target_version": "1.13.0",
    "current_version": "1.13.0",
    "compatibility_result": "compatible",
    "compatibility_rule": "target surface_version is inside the consumer's accepted_surface_range",
    "transitions": []
  },
  "release_ledger": {
    "ledger_schema_version": "campaigns-os-release-ledger/v1",
    "entries": []
  },
  "changelog": {
    "sections": []
  },
  "runtime": {
    "recipe_id": null,
    "source_fingerprint": "3333333333333333333333333333333333333333333333333333333333333333",
    "generated_state": "fresh",
    "emitter_commit": "1111111111111111111111111111111111111111",
    "refresh_action": "none",
    "ready": true
  },
  "transaction": {
    "state": "none",
    "commit_before": "1111111111111111111111111111111111111111",
    "commit_target": "1111111111111111111111111111111111111111",
    "commit_observed": "1111111111111111111111111111111111111111",
    "recovered_interrupted_update": false
  },
  "outcome": {
    "disposition": "refused",
    "reason_code": "orientation_too_large",
    "active_generation_changed": false,
    "fresh_exec_required": false,
    "next_actions": [
      "adopt a newer reviewed baseline",
      "raise the limit as a reviewed policy change"
    ],
    "refusal_remedy": "Adopt a newer reviewed baseline so the window is smaller, or raise the limit as a reviewed policy change that advances limits_version and carries its own ledger entry. Orientation refuses; it never truncates."
  },
  "limits": {
    "limits_version": "1.0.0",
    "max_source_bytes": 1048576,
    "max_section_count": 64,
    "max_section_bytes": 65536,
    "max_envelope_bytes": 262144,
    "max_ledger_entries": 256,
    "applied": {
      "source_bytes": 1048577,
      "section_count": 8,
      "max_observed_section_bytes": 3903,
      "envelope_bytes": 4096,
      "ledger_entries": 1
    },
    "exceeded": [
      "max_source_bytes"
    ]
  }
}
